{
  "event_id": "4372e2bf-f1bb-4ed0-8c82-5c23e0f5110d",
  "event_type": "cable.layout_changed",
  "schema_version": 1,
  "occurred_at": "2026-09-26T12:00:00.000Z",
  "tenant_id": "473f9f6d-d836-4091-9e8b-74822e1c10c2",
  "aggregate_type": "cable",
  "aggregate_id": "6df9fd31-694a-498f-b90a-f8d9ead9b3e4",
  "aggregate_version": "1",
  "correlation_id": "5fc7decc-0ebd-4894-99af-a19eb0a6f019",
  "causation_id": "0a3d3501-1be4-4e3f-a6db-e5282db00f60",
  "traceparent": "00-4bf92f3577b34da6a3ce929d0e0e4736-00f067aa0ba902b7-01",
  "payload": {
    "device_id": "464150c0-46c9-41eb-8052-3149c31aa136",
    "bin_id": "645805ea-1975-46e1-87bb-328162644742",
    "cable_id": "6df9fd31-694a-498f-b90a-f8d9ead9b3e4",
    "cable_version": "1",
    "operation": "upsert",
    "sensors": [
      {
        "sensor_id": "8d4e0e50-f8df-4160-9751-3a5414c386bd",
        "position": 1,
        "label": "Top",
        "depth_m": null
      },
      {
        "sensor_id": "dcc91905-766d-4ef5-8c6e-1eac22d338c5",
        "position": 2,
        "label": "Lower",
        "depth_m": 1.25
      }
    ]
  }
}
